<?xml version="1.0" encoding="UTF-8"?>
<!-- The datasource file is only an example file -->
<datasources xmlns="http://libo.com/db"
	xmlns:xsi="http://www.w3.org/2001/XMLSchema-instance"
	xsi:schemaLocation="http://libo.com/db/libo-db.xsd">
	
	<constants>
		<constant name="max-connection-size" value="100"/>
	 	<constant name="min-connection-size" value="5"/>
	 	<constant name="init-connection-size" value="10"/>
	 	<constant name="available-connection-size" value="2"/>
	 	<constant name="acquire-increment-size" value="10"/>
	 	
	 	<constant name="max-connection-idletime" value="3600"/>
	 	<constant name="max-connection-lifetime" value="14400"/>
	 	<constant name="idle-connection-test-period" value="3600"/>
	 	<constant name="connection-timeout" value="5"/>
	 	 
		<constant name="acquire-retry-attempts" value="10"/>
		<constant name="acquire-retry-delay" value="1000"/>
		
		<constant name="test-sql" value="SELECT 1"/>
		<constant name="test-connection-checkout" value="true"/>
		<constant name="test-connection-checkin" value="true"/>
	 	
	 	<constant name="load-on-startup" value="true"/>
	 	<constant name="show-sql" value="false"/>
		
		<constant name="connection-provider" value="com.libo.db.connection.c3p0.C3P0ConnectionProvider"/>
		<!-- 
		<constant name="connection-provider" value="com.libo.db.connection.bonecp.BoneCPConnectionProvider"/>
		 -->
	</constants>
	
	<datasource>
		<name>my</name>
		<driver-class>com.mysql.jdbc.Driver</driver-class>
		<driver-url>jdbc:mysql://10.0.125.15:3306/crm_v3</driver-url>
		<user>root</user>
		<password>libo2011</password>
		
		<max-connection-size>100</max-connection-size>
		<min-connection-size>5</min-connection-size>
		<init-connection-size>10</init-connection-size>
		<available-connection-size>2</available-connection-size>
		<acquire-increment-size>10</acquire-increment-size>
		
		<max-connection-idletime>3600</max-connection-idletime>
		<max-connection-lifetime>14400</max-connection-lifetime>
		<idle-connection-test-period>3600</idle-connection-test-period>
		<connection-timeout>5</connection-timeout>
		
		<acquire-retry-attempts>10</acquire-retry-attempts>
		<acquire-retry-delay>1000</acquire-retry-delay>
		
		<test-sql>SELECT 1</test-sql>
		<test-connection-checkin>false</test-connection-checkin>
		<test-connection-checkout>false</test-connection-checkout>
		
		<load-on-startup>true</load-on-startup>
		<show-sql>false</show-sql>
		
		<connection-provider>com.libo.db.connection.c3p0.C3P0ConnectionProvider</connection-provider>
		<!-- 
		<connection-provider>com.libo.db.connection.bonecp.BoneCPConnectionProvider</connection-provider>
		 -->
		
		<customize>
			<yourname>your value</yourname>
			<!-- 0 å°å¤ä¸ª
			<xxx>...</xxx>
			 -->
		</customize>
		
	</datasource>
	
	<!-- 0 å° å¤ä¸ª
	<datasource>
		<name></name>
		<driver-class></driver-class>
		<driver-url></driver-url>
		<user></user>
		<password></password>
		......			
	</datasource>
	 -->
	
	<include datasource="/yourdatasource.xml"/>
	
	<!-- 0 å°å¤ä¸ª
	<include datasource="your datasource xml path"/>
	 -->
	 
	<link-mapping name="you" linkto="my"/>
	
	<!-- 0 å°å¤ä¸ª
	<link-mapping name="..." linkto="..."/>
	 -->
	
</datasources>